9-12,HSN,VM,B,4b,"CC.9-12.N.VM.4b (+) Given two vectors in magnitude and direction form, determine the magnitude and direction of their sum. "
9-12,HSN,VM,B,4c,"CC.9-12.N.VM.4c (+) Understand vector subtraction v – w as v + (–w), where (–w) is the additive inverse of w, with the same magnitude as w and pointing in the opposite direction. Represent vector subtraction graphically by connecting the tips in the appropriate order, and perform vector subtraction component-wise."
9-12,HSN,VM,B,5,CC.9-12.N.VM.5 (+) Perform operations on vectors. Multiply a vector by a scalar.
9-12,HSN,VM,B,5a,"CC.9-12.N.VM.5a (+) Represent scalar multiplication graphically by scaling vectors and possibly reversing their direction; perform scalar multiplication component-wise, e.g., as c(v(sub x), v(sub y)) = (cv(sub x), cv(sub y))."
9-12,HSN,VM,B,5b,"CC.9-12.N.VM.5b (+) Compute the magnitude of a scalar multiple cv using ||cv|| = |c|v. Compute the direction of cv knowing that when |c|v ≠ 0, the direction of cv is either along v (for c > 0) or against v (for c < 0)."
9-12,HSN,VM,C,6,"CC.9-12.N.VM.6 (+) Perform operations on matrices and use matrices in applications. Use matrices to represent and manipulate data, e.g., to represent payoffs or incidence relationships in a network. "
9-12,HSN,VM,C,7,"CC.9-12.N.VM.7 (+) Perform operations on matrices and use matrices in applications. Multiply matrices by scalars to produce new matrices, e.g., as when all of the payoffs in a game are doubled. "
9-12,HSN,VM,C,8,"CC.9-12.N.VM.8 (+) Perform operations on matrices and use matrices in applications. Add, subtract, and multiply matrices of appropriate dimensions."
9-12,HSN,VM,C,9,"CC.9-12.N.VM.9 (+) Perform operations on matrices and use matrices in applications.  Understand that, unlike multiplication of numbers, matrix multiplication for square matrices is not a commutative operation, but still satisfies the associative and distributive properties. "
9-12,HSN,VM,C,10,CC.9-12.N.VM.10 (+) Perform operations on matrices and use matrices in applications. Understand that the zero and identity matrices play a role in matrix addition and multiplication similar to the role of 0 and 1 in the real numbers. The determinant of a square matrix is nonzero if and only if the matrix has a multiplicative inverse. 
9-12,HSN,VM,C,11,CC.9-12.N.VM.11 (+) Perform operations on matrices and use matrices in applications. Multiply a vector (regarded as a matrix with one column) by a matrix of suitable dimensions to produce another vector. Work with matrices as transformations of vectors.
9-12,HSN,VM,C,12,"CC.9-12.N.VM.12 (+) Perform operations on matrices and use matrices in applications. Work with 2 X 2 matrices as transformations of the plane, and interpret the absolute value of the determinant in terms of area. "
9-12,HSA,SSE,A,1,CC.9-12.A.SSE.1 Interpret the structure of expressions. Interpret expressions that represent a quantity in terms of its context.*
9-12,HSA,SSE,A,1a,"CC.9-12.A.SSE.1a Interpret parts of an expression, such as terms, factors, and coefficients.*"
9-12,HSA,SSE,A,1b,"CC.9-12.A.SSE.1b Interpret complicated expressions by viewing one or more of their parts as a single entity. For example, interpret P(1+r)^n as the product of P and a factor not depending on P.*"
9-12,HSA,SSE,A,2,"CC.9-12.A.SSE.2 Interpret the structure of expressions. Use the structure of an expression to identify ways to rewrite it. For example, see x^4 – y^4 as (x^2)^2 – (y^2)^2, thus recognizing it as a difference of squares that can be factored as (x^2 – y^2)(x^2 + y^2)."
9-12,HSA,SSE,B,3,CC.9-12.A.SSE.3  Write expressions in equivalent forms to solve problems. Choose and produce an equivalent form of an expression to reveal and explain properties of the quantity represented by the expression.*
9-12,HSA,SSE,B,3a,CC.9-12.A.SSE.3a Factor a quadratic expression to reveal the zeros of the function it defines.*
9-12,HSA,SSE,B,3b,CC.9-12.A.SSE.3b Complete the square in a quadratic expression to reveal the maximum or minimum value of the function it defines.*
9-12,HSA,SSE,B,3c,CC.9-12.A.SSE.3c Use the properties of exponents to transform expressions for exponential functions. For example the expression 1.15^t can be rewritten as [1.15^(1/12)]^(12t) ≈ 1.012^(12t) to reveal the approximate equivalent monthly interest rate if the annual rate is 15%.*
9-12,HSA,SSE,B,4,"CC.9-12.A.SSE.4 Write expressions in equivalent forms to solve problems. Derive the formula for the sum of a finite geometric series (when the common ratio is not 1), and use the formula to solve problems. For example, calculate mortgage payments.*"
9-12,HSA,APR,A,1,"CC.9-12.A.APR.1 Perform arithmetic operations on polynomials. Understand that polynomials form a system analogous to the integers, namely, they are closed under the operations of addition, subtraction, and multiplication; add, subtract, and multiply polynomials."
9-12,HSA,APR,B,2,"CC.9-12.A.APR.2 Understand the relationship between zeros and factors of polynomial. Know and apply the Remainder Theorem: For a polynomial p(x) and a number a, the remainder on division by x – a is p(a), so p(a) = 0 if and only if (x – a) is a factor of p(x)."
9-12,HSA,APR,B,3,"CC.9-12.A.APR.3 Understand the relationship between zeros and factors of polynomials. Identify zeros of polynomials when suitable factorizations are available, and use the zeros to construct a rough graph of the function defined by the polynomial."
9-12,HSA,APR,C,4,"CC.9-12.A.APR.4 Use polynomial identities to solve problems. Prove polynomial identities and use them to describe numerical relationships. For example, the polynomial identity (x^2 + y^2)^2 = (x^2 – y^2)^2 + (2xy)^2 can be used to generate Pythagorean triples."
9-12,HSA,APR,C,5,"CC.9-12.A.APR.5 (+) Use polynomial identities to solve problems. Know and apply that the Binomial Theorem gives the expansion of (x + y)^n in powers of x and y for a positive integer n, where x and y are any numbers, with coefficients determined for example by Pascal’s Triangle. (The Binomial Theorem can be proved by mathematical induction or by a combinatorial argument.)"
9-12,HSA,APR,D,6,"CC.9-12.A.APR.6 Rewrite rational expressions. Rewrite simple rational expressions in different forms; write a(x)/b(x) in the form q(x) + r(x)/b(x), where a(x), b(x), q(x), and r(x) are polynomials with the degree of r(x) less than the degree of b(x), using inspection, long division, or, for the more complicated examples, a computer algebra system."
9-12,HSA,APR,D,7,"CC.9-12.A.APR.7 (+) Rewrite rational expressions. Understand that rational expressions form a system analogous to the rational numbers, closed under addition, subtraction, multiplication, and division by a nonzero rational expression; add, subtract, multiply, and divide rational expressions."
9-12,HSA,CED,A,1,"CC.9-12.A.CED.1 Create equations that describe numbers or relationship. Create equations and inequalities in one variable and use them to solve problems. Include equations arising from linear and quadratic functions, and simple rational and exponential functions.*"
9-12,HSA,CED,A,2,CC.9-12.A.CED.2 Create equations that describe numbers or relationship. Create equations in two or more variables to represent relationships between quantities; graph equations on coordinate axes with labels and scales.*
9-12,HSA,CED,A,3,"CC.9-12.A.CED.3 Create equations that describe numbers or relationship. Represent constraints by equations or inequalities, and by systems of equations and/or inequalities, and interpret solutions as viable or non-viable options in a modeling context. For example, represent inequalities describing nutritional and cost constraints on combinations of different foods.*"
9-12,HSA,CED,A,4,"CC.9-12.A.CED.4 Create equations that describe numbers or relationship. Rearrange formulas to highlight a quantity of interest, using the same reasoning as in solving equations. For example, rearrange Ohm’s law V = IR to highlight resistance R.*"
9-12,HSA,REI,A,1,"CC.9-12.A.REI.1 Understand solving equations as a process of reasoning and explain the reasoning.  Explain each step in solving a simple equation as following from the equality of numbers asserted at the previous step, starting from the assumption that the original equation has a solution. Construct a viable argument to justify a solution method."
9-12,HSA,REI,A,2,"CC.9-12.A.REI.2 Understand solving equations as a process of reasoning and explain the reasoning. Solve simple rational and radical equations in one variable, and give examples showing how extraneous solutions may arise."
9-12,HSA,REI,B,3,"CC.9-12.A.REI.3 Solve equations and inequalities in one variable. Solve linear equations and inequalities in one variable, including equations with coefficients represented by letters. "
9-12,HSA,REI,B,4,CC.9-12.A.REI.4 Solve equations and inequalities in one variable. Solve quadratic equations in one variable. 
9-12,HSA,REI,B,4a,CC.9-12.A.REI.4a Use the method of completing the square to transform any quadratic equation in x into an equation of the form (x – p)^2 = q that has the same solutions. Derive the quadratic formula from this form. 
9-12,HSA,REI,B,4b,"CC.9-12.A.REI.4b Solve quadratic equations by inspection (e.g., for x^2 = 49), taking square roots, completing the square, the quadratic formula and factoring, as appropriate to the initial form of the equation. Recognize when the quadratic formula gives complex solutions and write them as a ± bi for real numbers a and b."
9-12,HSA,REI,C,5,"CC.9-12.A.REI.5 Solve systems of equations. Prove that, given a system of two equations in two variables, replacing one equation by the sum of that equation and a multiple of the other produces a system with the same solutions."
9-12,HSA,REI,C,6,"CC.9-12.A.REI.6 Solve systems of equations.  Solve systems of linear equations exactly and approximately (e.g., with graphs), focusing on pairs of linear equations in two variables."
9-12,HSA,REI,C,7,"CC.9-12.A.REI.7 Solve systems of equations. Solve a simple system consisting of a linear equation and a quadratic equation in two variables algebraically and graphically. For example, find the points of intersection between the line y = –3x and the circle x^2 + y^2 = 3."
9-12,HSA,REI,C,8,CC.9-12.A.REI.8 (+) Solve systems of equations. Represent a system of linear equations as a single matrix equation in a vector variable.
9-12,HSA,REI,C,9,CC.9-12.A.REI.9 (+) Solve systems of equations. Find the inverse of a matrix if it exists and use it to solve systems of linear equations (using technology for matrices of dimension 3 × 3 or greater).
9-12,HSA,REI,D,10,"CC.9-12.A.REI.10 Represent and solve equations and inequalities graphically. Understand that the graph of an equation in two variables is the set of all its solutions plotted in the coordinate plane, often forming a curve (which could be a line)."
9-12,HSA,REI,D,11,"CC.9-12.A.REI.11 Represent and solve equations and inequalities graphically. Explain why the x-coordinates of the points where the graphs of the equations y = f(x) and y = g(x) intersect are the solutions of the equation f(x) = g(x); find the solutions approximately, e.g., using technology to graph the functions, make tables of values, or find successive approximations. Include cases where f(x) and/or g(x) are linear, polynomial, rational, absolute value, exponential, and logarithmic functions.*"
9-12,HSA,REI,D,12,"CC.9-12.A.REI.12 Represent and solve equations and inequalities graphically. Graph the solutions to a linear inequality in two variables as a half-plane (excluding the boundary in the case of a strict inequality), and graph the solution set to a system of linear inequalities in two variables as the intersection of the corresponding half-planes."
9-12,HSF,IF,A,1,"CC.9-12.F.IF.1 Understand the concept of a function and use function notation. Understand that a function from one set (called the domain) to another set (called the range) assigns to each element of the domain exactly one element of the range. If f is a function and x is an element of its domain, then f(x) denotes the output of f corresponding to the input x. The graph of f is the graph of the equation y = f(x)."
9-12,HSF,IF,A,2,"CC.9-12.F.IF.2 Understand the concept of a function and use function notation. Use function notation, evaluate functions for inputs in their domains, and interpret statements that use function notation in terms of a context."
9-12,HSF,IF,A,3,"CC.9-12.F.IF.3 Understand the concept of a function and use function notation. Recognize that sequences are functions, sometimes defined recursively, whose domain is a subset of the integers. For example, the Fibonacci sequence is defined recursively by f(0) = f(1) = 1, f(n+1) = f(n) + f(n-1) for n ≥ 1 (n is greater than or equal to 1)."
9-12,HSF,IF,B,4,"CC.9-12.F.IF.4 Interpret functions that arise in applications in terms of the context. For a function that models a relationship between two quantities, interpret key features of graphs and tables in terms of the quantities, and sketch graphs showing key features given a verbal description of the relationship. Key features include: intercepts; intervals where the function is increasing, decreasing, positive, or negative; relative maximums and minimums; symmetries; end behavior; and periodicity.*"
9-12,HSF,IF,B,5,"CC.9-12.F.IF.5 Interpret functions that arise in applications in terms of the context. Relate the domain of a function to its graph and, where applicable, to the quantitative relationship it describes. For example, if the function h(n) gives the number of person-hours it takes to assemble n engines in a factory, then the positive integers would be an appropriate domain for the function.*"
9-12,HSF,IF,B,6,CC.9-12.F.IF.6 Interpret functions that arise in applications in terms of the context.  Calculate and interpret the average rate of change of a function (presented symbolically or as a table) over a specified interval. Estimate the rate of change from a graph.*
9-12,HSF,IF,C,7,"CC.9-12.F.IF.7 Analyze functions using different representations. Graph functions expressed symbolically and show key features of the graph, by hand in simple cases and using technology for more complicated cases.*"
9-12,HSF,IF,C,7a,"CC.9-12.F.IF.7a Graph linear and quadratic functions and show intercepts, maxima, and minima.*"
9-12,HSF,IF,C,7b,"CC.9-12.F.IF.7b Graph square root, cube root, and piecewise-defined functions, including step functions and absolute value functions.* "
9-12,HSF,IF,C,7c,"CC.9-12.F.IF.7c Graph polynomial functions, identifying zeros when suitable factorizations are available, and showing end behavior.* "
9-12,HSF,IF,C,7d,"CC.9-12.F.IF.7d (+) Graph rational functions, identifying zeros and asymptotes when suitable factorizations are available, and showing end behavior.* "
9-12,HSF,IF,C,7e,"CC.9-12.F.IF.7e Graph exponential and logarithmic functions, showing intercepts and end behavior, and trigonometric functions, showing period, midline, and amplitude.*"
9-12,HSF,IF,C,8,CC.9-12.F.IF.8 Analyze functions using different representations. Write a function defined by an expression in different but equivalent forms to reveal and explain different properties of the function. 
9-12,HSF,IF,C,8a,"CC.9-12.F.IF.8a Use the process of factoring and completing the square in a quadratic function to show zeros, extreme values, and symmetry of the graph, and interpret these in terms of a context. "
9-12,HSF,IF,C,8b,"CC.9-12.F.IF.8b Use the properties of exponents to interpret expressions for exponential functions. For example, identify percent rate of change in functions such as y = (1.02)^t, y = (0.97)^t, y = (1.01)^(12t), y = (1.2)^(t/10), and classify them as representing exponential growth and decay."
9-12,HSF,IF,C,9,"CC.9-12.F.IF.9 Analyze functions using different representations. Compare properties of two functions each represented in a different way (algebraically, graphically, numerically in tables, or by verbal descriptions). For example, given a graph of one quadratic function and an algebraic expression for another, say which has the larger maximum."
9-12,HSF,BF,A,1,CC.9-12.F.BF.1 Build a function that models a relationship between two quantities. Write a function that describes a relationship between two quantities.* 
9-12,HSF,BF,A,1a,"CC.9-12.F.BF.1a Determine an explicit expression, a recursive process, or steps for calculation from a context. "
9-12,HSF,BF,A,1b,"CC.9-12.F.BF.1b Combine standard function types using arithmetic operations. For example, build a function that models the temperature of a cooling body by adding a constant function to a decaying exponential, and relate these functions to the model. "
9-12,HSF,BF,A,1c,"CC.9-12.F.BF.1c (+) Compose functions. For example, if T(y) is the temperature in the atmosphere as a function of height, and h(t) is the height of a weather balloon as a function of time, then T(h(t)) is the temperature at the location of the weather balloon as a function of time."
9-12,HSF,BF,A,2,"CC.9-12.F.BF.2 Build a function that models a relationship between two quantities. Write arithmetic and geometric sequences both recursively and with an explicit formula, use them to model situations, and translate between the two forms.*"
9-12,HSF,BF,B,3,"CC.9-12.F.BF.3 Build new functions from existing functions. Identify the effect on the graph of replacing f(x) by f(x) + k, k f(x), f(kx), and f(x + k) for specific values of k (both positive and negative); find the value of k given the graphs. Experiment with cases and illustrate an explanation of the effects on the graph using technology. Include recognizing even and odd functions from their graphs and algebraic expressions for them."
9-12,HSF,BF,B,4,CC.9-12.F.BF.4 Build new functions from existing functions. Find inverse functions. 
9-12,HSF,BF,B,4a,"CC.9-12.F.BF.4a Solve an equation of the form f(x) = c for a simple function f that has an inverse and write an expression for the inverse. For example, f(x) =2(x^3) or f(x) = (x+1)/(x-1) for x ≠ 1 (x not equal to 1). "
9-12,HSF,BF,B,4b,CC.9-12.F.BF.4b (+) Verify by composition that one function is the inverse of another. 
9-12,HSF,BF,B,4c,"CC.9-12.F.BF.4c (+) Read values of an inverse function from a graph or a table, given that the function has an inverse."
9-12,HSF,BF,B,4d,CC.9-12.F.BF.4d (+) Produce an invertible function from a non-invertible function by restricting the domain.
9-12,HSF,BF,B,5,CC.9-12.F.BF.5 (+) Understand the inverse relationship between exponents and logarithms and use this relationship to solve problems involving logarithms and exponents.
9-12,HSF,LE,A,1,"CC.9-12.F.LE.1 Construct and compare linear, quadratic, and exponential models and solve problems. Distinguish between situations that can be modeled with linear functions and with exponential functions.*"
9-12,HSF,LE,A,1a,CC.9-12.F.LE.1a Prove that linear functions grow by equal differences over equal intervals and that exponential functions grow by equal factors over equal intervals.*
9-12,HSF,LE,A,1b,CC.9-12.F.LE.1b. Recognize situations in which one quantity changes at a constant rate per unit interval relative to another.*
9-12,HSF,LE,A,1c,CC.9-12.F.LE.1c Recognize situations in which a quantity grows or decays by a constant percent rate per unit interval relative to another.*
9-12,HSF,LE,A,2,"CC.9-12.F.LE.2 Construct and compare linear, quadratic, and exponential models and solve problems. Construct linear and exponential functions, including arithmetic and geometric sequences, given a graph, a description of a relationship, or two input-output pairs (include reading these from a table).*"
9-12,HSF,LE,A,3,"CC.9-12.F.LE.3 Construct and compare linear, quadratic, and exponential models and solve problems. Observe using graphs and tables that a quantity increasing exponentially eventually exceeds a quantity increasing linearly, quadratically, or (more generally) as a polynomial function.*"
9-12,HSF,LE,A,4,"CC.9-12.F.LE.4 Construct and compare linear, quadratic, and exponential models and solve problems. For exponential models, express as a logarithm the solution to ab^(ct) = d where a, c, and d are numbers and the base b is 2, 10, or e; evaluate the logarithm using technology.*"
9-12,HSF,LE,B,5,"CC.9-12.F.LE.5 Construct and compare linear, quadratic, and exponential models and solve problems. Interpret the parameters in a linear or exponential function in terms of a context.*"
9-12,HSF,TF,A,1,CC.9-12.F.TF.1 Extend the domain of trigonometric functions using the unit circle. Understand radian measure of an angle as the length of the arc on the unit circle subtended by the angle.
9-12,HSF,TF,A,2,"CC.9-12.F.TF.2 Extend the domain of trigonometric functions using the unit circle. Explain how the unit circle in the coordinate plane enables the extension of trigonometric functions to all real numbers, interpreted as radian measures of angles traversed counterclockwise around the unit circle."
9-12,HSF,TF,A,3,"CC.9-12.F.TF.3 (+) Extend the domain of trigonometric functions using the unit circle. Use special triangles to determine geometrically the values of sine, cosine, tangent for π/3, π/4 and π/6, and use the unit circle to express the values of sine, cosine, and tangent for π - x, π + x, and 2π - x in terms of their values for x, where x is any real number."
9-12,HSF,TF,A,4,CC.9-12.F.TF.4 (+) Extend the domain of trigonometric functions using the unit circle. Use the unit circle to explain symmetry (odd and even) and periodicity of trigonometric functions.
9-12,HSF,TF,B,5,"CC.9-12.F.TF.5 Model periodic phenomena with trigonometric functions. Choose trigonometric functions to model periodic phenomena with specified amplitude, frequency, and midline.* "
9-12,HSF,TF,B,6,CC.9-12.F.TF.6 (+) Model periodic phenomena with trigonometric functions. Understand that restricting a trigonometric function to a domain on which it is always increasing or always decreasing allows its inverse to be constructed.
9-12,HSF,TF,B,7,"CC.9-12.F.TF.7 (+) Model periodic phenomena with trigonometric functions. Use inverse functions to solve trigonometric equations that arise in modeling contexts; evaluate the solutions using technology, and interpret them in terms of the context.*"
9-12,HSF,TF,C,8,"CC.9-12.F.TF.8 Prove and apply trigonometric identities. Prove the Pythagorean identity (sin A)^2 + (cos A)^2 = 1 and use it to find sin A, cos A, or tan A, given sin A, cos A, or tan A, and the quadrant of the angle."
9-12,HSF,TF,C,9,"CC.9-12.F.TF.9 (+) Prove and apply trigonometric identities. Prove the addition and subtraction formulas for sine, cosine, and tangent and use them to solve problems."
9-12,HSG,CO,A,1,"CC.9-12.G.CO.1 Experiment with transformations in the plane. Know precise definitions of angle, circle, perpendicular line, parallel line, and line segment, based on the undefined notions of point, line, distance along a line, and distance around a circular arc."
9-12,HSG,CO,A,2,"CC.9-12.G.CO.2 Experiment with transformations in the plane. Represent transformations in the plane using, e.g., transparencies and geometry software; describe transformations as functions that take points in the plane as inputs and give other points as outputs. Compare transformations that preserve distance and angle to those that do not (e.g., translation versus horizontal stretch)."
9-12,HSG,CO,A,3,"CC.9-12.G.CO.3 Experiment with transformations in the plane. Given a rectangle, parallelogram, trapezoid, or regular polygon, describe the rotations and reflections that carry it onto itself."
9-12,HSG,CO,A,4,"CC.9-12.G.CO.4 Experiment with transformations in the plane. Develop definitions of rotations, reflections, and translations in terms of angles, circles, perpendicular lines, parallel lines, and line segments."
9-12,HSG,CO,A,5,"CC.9-12.G.CO.5 Experiment with transformations in the plane. Given a geometric figure and a rotation, reflection, or translation, draw the transformed figure using, e.g., graph paper, tracing paper, or geometry software. Specify a sequence of transformations that will carry a given figure onto another."
9-12,HSG,CO,B,6,"CC.9-12.G.CO.6 Understand congruence in terms of rigid motions. Use geometric descriptions of rigid motions to transform figures and to predict the effect of a given rigid motion on a given figure; given two figures, use the definition of congruence in terms of rigid motions to decide if they are congruent."
9-12,HSG,CO,B,7,CC.9-12.G.CO.7 Understand congruence in terms of rigid motions. Use the definition of congruence in terms of rigid motions to show that two triangles are congruent if and only if corresponding pairs of sides and corresponding pairs of angles are congruent.
9-12,HSG,CO,B,8,"CC.9-12.G.CO.8 Understand congruence in terms of rigid motions. Explain how the criteria for triangle congruence (ASA, SAS, and SSS) follow from the definition of congruence in terms of rigid motions."
9-12,HSG,CO,C,9,"CC.9-12.G.CO.9 Prove geometric theorems. Prove theorems about lines and angles. Theorems include: vertical angles are congruent; when a transversal crosses parallel lines, alternate interior angles are congruent and corresponding angles are congruent; points on a perpendicular bisector of a line segment are exactly those equidistant from the segment’s endpoints."
9-12,HSG,CO,C,10,CC.9-12.G.CO.10 Prove geometric theorems. Prove theorems about triangles. Theorems include: measures of interior angles of a triangle sum to 180 degrees; base angles of isosceles triangles are congruent; the segment joining midpoints of two sides of a triangle is parallel to the third side and half the length; the medians of a triangle meet at a point.
