Grade,COURSE,Domain or Conceptual Theme,Cluster,Standard #,Standard
K,,CC,A,1,CC.K.CC.1 Know number names and the count sequence. Count to 100 by ones and by tens. 
K,,CC,A,2,"CC.K.CC.2 Know number names and the count sequence. Count forward beginning from a given number within the known sequence (instead of having to begin at 1).
"
K,,CC,A,3,CC.K.CC.3 Know number names and the count sequence. Write numbers from 0 to 20. Represent a number of objects with a written numeral 0-20 (with 0 representing a count of no objects).
K,,CC,B,4,CC.K.CC.4 Count to tell the number of objects. Understand the relationship between numbers and quantities; connect counting to cardinality. 
K,,CC,B,4a,"CC.K.CC.4a When counting objects, say the number names in the standard order, pairing each object with one and only one number name and each number name with one and only one object."
K,,CC,B,4b,CC.K.CC.4b Understand that the last number name said tells the number of objects counted. The number of objects is the same regardless of their arrangement or the order in which they were counted.
K,,CC,B,4c,CC.K.CC.4c Understand that each successive number name refers to a quantity that is one larger. 
K,,CC,B,5,"CC.K.CC.5 Count to tell the number of objects. Count to answer “how many?” questions about as many as 20 things arranged in a line, a rectangular array, or a circle, or as many as 10 things in a scattered configuration; given a number from 1-20, count out that many objects."
K,,CC,C ,6,"CC.K.CC.6 Compare numbers. Identify whether the number of objects in one group is greater than, less than, or equal to the number of objects in another group, e.g., by using matching and counting strategies.  (Include groups with up to ten objects.)"
K,,CC,C,7,CC.K.CC.7 Compare numbers. Compare two numbers between 1 and 10 presented as written numerals.
K,,OA,A,1,"CC.K.OA.1 Understand addition as putting together and adding to, and understand subtraction as taking apart and taking from.  Represent addition and subtraction with objects, fingers, mental images, drawings (drawings need not show details, but should show the mathematics in the problem),  sounds (e.g., claps), acting out situations, verbal explanations, expressions, or equations. "
K,,OA,A,2,"CC.K.OA.2 Understand addition as putting together and adding to, and understand subtraction as taking apart and taking from. Solve addition and subtraction word problems, and add and subtract within 10, e.g., by using objects or drawings to represent the problem."
K,,OA,A,3,"CC.K.OA.3 Understand addition as putting together and adding to, and understand subtraction as taking apart and taking from. Decompose numbers less than or equal to 10 into pairs in more than one way, e.g., by using objects or drawings, and record each decomposition by a drawing or equation (e.g., 5 = 2 + 3 and 5 = 4 + 1). "
K,,OA,A,4,"CC.K.OA.4 Understand addition as putting together and adding to, and understand subtraction as taking apart and taking from. For any number from 1 to 9, find the number that makes 10 when added to the given number, e.g., by using objects or drawings, and record the answer with a drawing or equation."
K,,OA,A,5,"CC.K.OA.5 Understand addition as putting together and adding to, and understand subtraction as taking apart and taking from. Fluently add and subtract within 5."
K,,NBT,A,1,"CC.K.NBT.1 Work with numbers 11-19 to gain foundations for place value. Compose and decompose numbers from 11 to 19 into ten ones and some further ones, e.g., by using objects or drawings, and record each composition or decomposition by a drawing or equation (such as 18 = 10 + 8); understand that these numbers are composed of ten ones and one, two, three, four, five, six, seven, eight, or nine ones. "
K,,MD,A,1,"CC.K.MD.1 Describe and compare measurable attributes.  Describe measurable attributes of objects, such as length or weight. Describe several measurable attributes of a single object."
K,,MD,A,2,"CC.K.MD.2 Describe and compare measurable attributes. Directly compare two objects with a measurable attribute in common, to see which object has “more of”/“less of” the attribute, and describe the difference. For example, directly compare the heights of two children and describe one child as taller/shorter."
K,,MD,B,3,CC.K.MD.3 Classify objects and count the number of objects in each category. Classify objects into given categories; count the numbers of objects in each category and sort the categories by count. (Limit category counts to be less than or equal to 10.)
K,,G,A,1,"CC.K.G.1 Identify and describe shapes (squares, circles, triangles, rectangles, hexagons, cubes, cones, cylinders, and spheres). Describe objects in the environment using names of shapes, and describe the relative positions of these objects using terms such as above, below, beside, in front of, behind, and next to."
K,,G,A,2,"CC.K.G.2 Identify and describe shapes (such as squares, circles, triangles, rectangles, hexagons, cubes, cones, cylinders, and spheres). Correctly name shapes regardless of their orientations or overall size."
K,,G,A,3,"CC.K.G.3 Identify and describe shapes (such as squares, circles, triangles, rectangles, hexagons, cubes, cones, cylinders, and spheres). Identify shapes as two-dimensional (lying in a plane, “flat”) or three-dimensional (“solid”)."
K,,G,B,4,"CC.K.G.4 Analyze, compare, create, and compose shapes. Analyze and compare two- and three-dimensional shapes, in different sizes and orientations, using informal language to describe their similarities, differences, parts (e.g., number of sides and vertices/“corners”) and other attributes (e.g., having sides of equal length)."
K,,G,B,5,"CC.K.G.5 Analyze, compare, create, and compose shapes. Model shapes in the world by building shapes from components (e.g., sticks and clay balls) and drawing shapes."
K,,G,B,6,"CC.K.G.6 Analyze, compare, create, and compose shapes. Compose simple shapes to form larger shapes. For example, ""can you join these two triangles with full sides touching to make a rectangle?”"
1,,OA,A,1,"CC.1.OA.1 Represent and solve problems involving addition and subtraction. Use addition and subtraction within 20 to solve word problems involving situations of adding to, taking from, putting together, taking apart, and comparing, with unknowns in all positions, e.g., by using objects, drawings, and equations with a symbol for the unknown number to represent the problem. "
1,,OA,A,2,"CC.1.OA.2 Represent and solve problems involving addition and subtraction. Solve word problems that call for addition of three whole numbers whose sum is less than or equal to 20, e.g., by using objects, drawings, and equations with a symbol for the unknown number to represent the problem."
1,,OA,B,3,"CC.1.OA.3 Understand and apply properties of operations and the relationship between addition and subtraction. Apply properties of operations as strategies to add and subtract.   Examples: If 8 + 3 = 11 is known, then 3 + 8 = 11 is also known. (Commutative property of addition.)  To add 2 + 6 + 4, the second two numbers can be added to make a ten, so 2 + 6 + 4 = 2 + 10 = 12. (Associative property of addition.) (Students need not use formal terms for these properties.)"
1,,OA,B,4,"CC.1.OA.4 Understand and apply properties of operations and the relationship between addition and subtraction. Understand subtraction as an unknown-addend problem. For example, subtract 10 – 8 by finding the number that makes 10 when added to 8. "
1,,OA,C,5,"CC.1.OA.5 Add and subtract within 20. Relate counting to addition and subtraction (e.g., by counting on 2 to add 2)."
1,,OA,C,6,"CC.1.OA.6 Add and subtract within 20.  Add and subtract within 20, demonstrating fluency for addition and subtraction within 10. Use strategies such as counting on; making ten (e.g., 8 + 6 = 8 + 2 + 4 = 10 + 4 = 14); decomposing a number leading to a ten (e.g., 13 – 4 = 13 – 3 – 1 = 10 – 1 = 9); using the relationship between addition and subtraction (e.g., knowing that 8 + 4 = 12, one knows 12 – 8 = 4); and creating equivalent but easier or known sums (e.g., adding 6 + 7 by creating the known equivalent 6 + 6 + 1 = 12 + 1 = 13)."
1,,OA,D,7,"CC.1.OA.7 Work with addition and subtraction equations.  Understand the meaning of the equal sign, and determine if equations involving addition and subtraction are true or false. For example, which of the following equations are true and which are false? 6 = 6,  7 = 8 – 1,  5 + 2 = 2 + 5,  4 + 1 = 5 + 2."
1,,OA,D,8,"CC.1.OA.8 Work with addition and subtraction equations. Determine the unknown whole number in an addition or subtraction equation relating three whole numbers. For example, determine the unknown number that makes the equation true in each of the equations 8 + ? = 11, 5 = ＿ – 3,  6 + 6 = ＿. "
1,,NBT,A,1,"CC.1.NBT.1 Extend the counting sequence. Count to 120, starting at any number less than 120. In this range, read and write numerals and represent a number of objects with a written numeral."
1,,NBT,B,2,"CC.1.NBT.2 Understand place value. Understand that the two digits of a two-digit number represent amounts of tens and ones. Understand the following as special cases:
  --  a. 10 can be thought of as a bundle of ten ones — called a “ten.”
  --  b. The numbers from 11 to 19 are composed of a ten and one, two, three, four, five, six, seven, eight, or nine ones. 
  --  c. The numbers 10, 20, 30, 40, 50, 60, 70, 80, 90 refer to one, two, three, four, five, six, seven, eight, or nine tens (and 0 ones)."
1,,NBT,B,3,"CC.1.NBT.3 Understand place value. Compare two two-digit numbers based on meanings of the tens and ones digits, recording the results of comparisons with the symbols >, =, and <. "
1,,NBT,C,4,"CC.1.NBT.4 Use place value understanding and properties of operations to add and subtract. Add within 100, including adding a two-digit number and a one-digit number, and adding a two-digit number and a multiple of 10, using concrete models or drawings and strategies based on place value, properties of operations, and/or the relationship between addition and subtraction; relate the strategy to a written method and explain the reasoning used. Understand that in adding two-digit numbers, one adds tens and tens, ones and ones; and sometimes it is necessary to compose a ten. "
1,,NBT,C,5,"CC.1.NBT.5 Use place value understanding and properties of operations to add and subtract. Given a two-digit number, mentally find 10 more or 10 less than the number, without having to count; explain the reasoning used."
1,,NBT,C,6,"CC.1.NBT.6 Use place value understanding and properties of operations to add and subtract. Subtract multiples of 10 in the range 10-90 from multiples of 10 in the range 10-90 (positive or zero differences), using concrete models or drawings and strategies based on place value, properties of operations, and/or the relationship between addition and subtraction; relate the strategy to a written method and explain the reasoning used.  "
1,,MD,A,1,CC.1.MD.1 Measure lengths indirectly and by iterating length units. Order three objects by length; compare the lengths of two objects indirectly by using a third object. 
1,,MD,A,2,"CC.1.MD.2 Measure lengths indirectly and by iterating length units. Express the length of an object as a whole number of length units, by laying multiple copies of a shorter object (the length unit) end to end; understand that the length measurement of an object is the number of same-size length units that span it with no gaps or overlaps. Limit to contexts where the object being measured is spanned by a whole number of length units with no gaps or overlaps."
1,,MD,B,3,CC.1.MD.3 Tell and write time. Tell and write time in hours and half-hours using analog and digital clocks.
1,,MD,C,4,"CC.1.MD.4 Represent and interpret data. Organize, represent, and interpret data with up to three categories; ask and answer questions about the total number of data points, how many in each category, and how many more or less are in one category than in another."
1,,G,A,1,"CC.1.G.1 Reason with shapes and their attributes. Distinguish between defining attributes (e.g., triangles are closed and three-sided) versus non-defining attributes (e.g., color, orientation, overall size); for a wide variety of shapes; build and draw shapes to possess defining attributes."
1,,G,A,2,"CC.1.G.2 Reason with shapes and their attributes. Compose two-dimensional shapes (rectangles, squares, trapezoids, triangles, half-circles, and quarter-circles) or three-dimensional shapes (cubes, right rectangular prisms, right circular cones, and right circular cylinders) to create a composite shape, and compose new shapes from the composite shape. (Students do not need to learn formal names such as “right rectangular prism.”)"
1,,G,A,3,"CC.1.G.3 Reason with shapes and their attributes. Partition circles and rectangles into two and four equal shares, describe the shares using the words halves, fourths, and quarters, and use the phrases half of, fourth of, and quarter of. Describe the whole as two of, or four of the shares. Understand for these examples that decomposing into more equal shares creates smaller shares. "
2,,OA,A,1,"CC.2.OA.1 Represent and solve problems involving addition and subtraction. Use addition and subtraction within 100 to solve one- and two-step word problems involving situations of adding to, taking from, putting together, taking apart, and comparing, with unknowns in all positions, e.g., by using drawings and equations with a symbol for the unknown number to represent the problem. "
2,,OA,B,2,"CC.2.OA.2 Add and subtract within 20. Fluently add and subtract within 20 using mental strategies. By end of Grade 2, know from memory all sums of two one-digit numbers. "
2,,OA,C,3,"CC.2.OA.3 Work with equal groups of objects to gain foundations for multiplication. Determine whether a group of objects (up to 20) has an odd or even number of members, e.g., by pairing objects or counting them by 2s; write an equation to express an even number as a sum of two equal addends."
2,,OA,C,4,CC.2.OA.4 Work with equal groups of objects to gain foundations for multiplication. Use addition to find the total number of objects arranged in rectangular arrays with up to 5 rows and up to 5 columns; write an equation to express the total as a sum of equal addends.
2,,NBT,A,1,"CC.2.NBT.1 Understand place value. Understand that the three digits of a three-digit number represent amounts of hundreds, tens, and ones; e.g., 706 equals 7 hundreds, 0 tens, and 6 ones. Understand the following as special cases:
  --  a. 100 can be thought of as a bundle of ten tens — called a “hundred.”
  --  b. The numbers 100, 200, 300, 400, 500, 600, 700, 800, 900 refer to one, two, three, four, five, six, seven, eight, or nine hundreds (and 0 tens and 0 ones)."
2,,NBT,A,2,"CC.2.NBT.2 Understand place value. Count within 1000; skip-count by 5s, 10s, and 100s."
2,,NBT,A,3,"CC.2.NBT.3 Understand place value. Read and write numbers to 1000 using base-ten numerals, number names, and expanded form."
2,,NBT,A,4,"CC.2.NBT.4 Understand place value. Compare two three-digit numbers based on meanings of the hundreds, tens, and ones digits, using >, =, and < symbols to record the results of comparisons."
2,,NBT,B,5,"CC.2.NBT.5 Use place value understanding and properties of operations to add and subtract. Fluently add and subtract within 100 using strategies based on place value, properties of operations, and/or the relationship between addition and subtraction. "
2,,NBT,B,6,CC.2.NBT.6 Use place value understanding and properties of operations to add and subtract. Add up to four two-digit numbers using strategies based on place value and properties of operations.
2,,NBT,B,7,"CC.2.NBT.7 Use place value understanding and properties of operations to add and subtract. Add and subtract within 1000, using concrete models or drawings and strategies based on place value, properties of operations, and/or the relationship between addition and subtraction; relate the strategy to a written method. Understand that in adding or subtracting three-digit numbers, one adds or subtracts hundreds and hundreds, tens and tens, ones and ones; and sometimes it is necessary to compose or decompose tens or hundreds."
2,,NBT,B,8,"CC.2.NBT.8 Use place value understanding and properties of operations to add and subtract. Mentally add 10 or 100 to a given number 100-900, and mentally subtract 10 or 100 from a given number 100-900."
2,,NBT,B,9,"CC.2.NBT.9 Use place value understanding and properties of operations to add and subtract. Explain why addition and subtraction strategies work, using place value and the properties of operations. (Explanations may be supported by drawings or objects.)  "
2,,MD,A,1,"CC.2.MD.1 Measure and estimate lengths in standard units. Measure the length of an object by selecting and using appropriate tools such as rulers, yardsticks, meter sticks, and measuring tapes. "
2,,MD,A,2,"CC.2.MD.2 Measure and estimate lengths in standard units. Measure the length of an object twice, using length units of different lengths for the two measurements; describe how the two measurements relate to the size of the unit chosen. "
2,,MD,A,3,"CC.2.MD.3 Measure and estimate lengths in standard units. Estimate lengths using units of inches, feet, centimeters, and meters."
2,,MD,A,4,"CC.2.MD.4 Measure and estimate lengths in standard units. Measure to determine how much longer one object is than another, expressing the length difference in terms of a standard length unit."
2,,MD,B,5,"CC.2.MD.5 Relate addition and subtraction to length. Use addition and subtraction within 100 to solve word problems involving lengths that are given in the same units, e.g., by using drawings (such as drawings of rulers) and equations with a symbol for the unknown number to represent the problem."
2,,MD,B,6,"CC.2.MD.6 Relate addition and subtraction to length.  Represent whole numbers as lengths from 0 on a number line diagram with equally spaced points corresponding to the numbers 0, 1, 2, … , and represent whole-number sums and differences within 100 on a number line diagram. "
2,,MD,C,7,"CC.2.MD.7 Work with time and money. Tell and write time from analog and digital clocks to the nearest five minutes, using a.m. and p.m. "
2,,MD,C,8,"CC.2.MD.8 Work with time and money. Solve word problems involving dollar bills, quarters, dimes, nickels, and pennies, using $ (dollars) and ¢ (cents) symbols appropriately. Example: If you have 2 dimes and 3 pennies, how many cents do you have? "
2,,MD,D,9,"CC.2.MD.9 Represent and interpret data. Generate measurement data by measuring lengths of several objects to the nearest whole unit, or by making repeated measurements of the same object. Show the measurements by making a line plot, where the horizontal scale is marked off in whole-number units."
2,,MD,D,10,"CC.2.MD.10 Represent and interpret data. Draw a picture graph and a bar graph (with single-unit scale) to represent a data set with up to four categories. Solve simple put-together, take-apart, and compare problems  using information presented in a bar graph. "
2,,G,A,1,"CC.2.G.1 Reason with shapes and their attributes. Recognize and draw shapes having specified attributes, such as a given number of angles or a given number of equal faces.  Identify triangles, quadrilaterals, pentagons, hexagons, and cubes. (Sizes are compared directly or visually, not compared by measuring.)"
2,,G,A,2,CC.2.G.2 Reason with shapes and their attributes. Partition a rectangle into rows and columns of same-size squares and count to find the total number of them. 
2,,G,A,3,"CC.2.G.3 Reason with shapes and their attributes. Partition circles and rectangles into two, three, or four equal shares, describe the shares using the words halves, thirds, half of, a third of, etc., and describe the whole as two halves, three thirds, four fourths. Recognize that equal shares of identical wholes need not have the same shape. "
3,,OA,A,1,"CC.3.OA.1 Represent and solve problems involving multiplication and division. Interpret products of whole numbers, e.g., interpret 5 × 7 as the total number of objects in 5 groups of 7 objects each. For example, describe a context in which a total number of objects can be expressed as 5 × 7. "
3,,OA,A,2,"CC.3.OA.2 Represent and solve problems involving multiplication and division. Interpret whole-number quotients of whole numbers, e.g., interpret 56 ÷ 8 as the number of objects in each share when 56 objects are partitioned equally into 8 shares, or as a number of shares when 56 objects are partitioned into equal shares of 8 objects each. For example, describe a context in which a number of shares or a number of groups can be expressed as 56 ÷ 8."
3,,OA,A,3,"CC.3.OA.3 Represent and solve problems involving multiplication and division. Use multiplication and division within 100 to solve word problems in situations involving equal groups, arrays, and measurement quantities, e.g., by using drawings and equations with a symbol for the unknown number to represent the problem. "
3,,OA,A,4,"CC.3.OA.4 Represent and solve problems involving multiplication and division. Determine the unknown whole number in a multiplication or division equation relating three whole numbers. For example, determine the unknown number that makes the equation true in each of the equations 8 × ? = 48,  5 = __÷ 3,  6 × 6 = ?."
3,,OA,A,5,"CC.3.OA.5 Understand properties of multiplication and the relationship between multiplication and division.  Apply properties of operations as strategies to multiply and divide.   Examples: If 6 × 4 = 24 is known, then 4 × 6 = 24 is also known. (Commutative property of multiplication.) 3 × 5 × 2 can be found by 3 × 5 = 15 then 15 × 2 = 30, or by 5 × 2 = 10 then 3 × 10 = 30. (Associative property of multiplication.) Knowing that 8 × 5 = 40 and 8 × 2 = 16, one can find 8 × 7 as 8 × (5 + 2) = (8 × 5) + (8 × 2) = 40 + 16 = 56. (Distributive property.) (Students need not use formal terms for these properties.)"
3,,OA,B,6,"CC.3.OA.6 Understand properties of multiplication and the relationship between multiplication and division.  Understand division as an unknown-factor problem. For example, divide 32 ÷ 8 by finding the number that makes 32 when multiplied by 8. "
3,,OA,C,7,"CC.3.OA.7 Multiply and divide within 100. Fluently multiply and divide within 100, using strategies such as the relationship between multiplication and division (e.g., knowing that 8 × 5 = 40, one knows 40 ÷ 5 = 8) or properties of operations. By the end of Grade 3, know from memory all products of one-digit numbers."
3,,OA,D,8,"CC.3.OA.8 Solve problems involving the four operations, and identify and explain patterns in arithmetic. Solve two-step word problems using the four operations. Represent these problems using equations with a letter standing for the unknown quantity. Assess the reasonableness of answers using mental computation and estimation strategies including rounding. (This standard is limited to problems posed with whole numbers and having whole-number answers; students should know how to perform operations in the conventional order when there are no parentheses to specify a particular order (Order of Operations).)"
3,,OA,D,9,"CC.3.OA.9 Solve problems involving the four operations, and identify and explain patterns in arithmetic.  Identify arithmetic patterns (including patterns in the addition table or multiplication table), and explain them using properties of operations. For example, observe that 4 times a number is always even, and explain why 4 times a number can be decomposed into two equal addends.   "
3,,NBT,A,1,CC.3.NBT.1 Use place value understanding and properties of operations to perform multi-digit arithmetic.  Use place value understanding to round whole numbers to the nearest 10 or 100.
3,,NBT,A,2,"CC.3.NBT.2 Use place value understanding and properties of operations to perform multi-digit arithmetic. Fluently add and subtract within 1000 using strategies and algorithms based on place value, properties of operations, and/or the relationship between addition and subtraction. (A range of algorithms may be used.)"
3,,NBT,A,3,"CC.3.NBT.3 Use place value understanding and properties of operations to perform multi-digit arithmetic. Multiply one-digit whole numbers by multiples of 10 in the range 10-90 (e.g., 9 × 80, 5 × 60) using strategies based on place value and properties of operations. (A range of algorithms may be used.)"
3,,NF,A,1,"CC.3.NF.1 Develop understanding of fractions as numbers. Understand a fraction 1/b as the quantity formed by 1 part when a whole is partitioned into b equal parts; understand a fraction a/b as the quantity formed by a parts of size 1/b.  (Grade 3 expectations in this domain are limited to fractions with denominators 2, 3, 4, 6, and 8.)"
3,,NF,A,2,"CC.3.NF.2 Develop understanding of fractions as numbers. Understand a fraction as a number on the number line; represent fractions on a number line diagram.  (Grade 3 expectations in this domain are limited to fractions with denominators 2, 3, 4, 6, and 8.)"
3,,NF,A,2a,"CC.3.NF.2a Represent a fraction 1/b on a number line diagram by defining the interval from 0 to 1 as the whole and partitioning it into b equal parts. Recognize that each part has size 1/b and that the endpoint of the part based at 0 locates the number 1/b on the number line.  (Grade 3 expectations in this domain are limited to fractions with denominators 2, 3, 4, 6, and 8.)"
3,,NF,A,2b,"CC.3.NF.2b Represent a fraction a/b on a number line diagram by marking off a lengths 1/b from 0. Recognize that the resulting interval has size a/b and that its endpoint locates the number a/b on the number line.  (Grade 3 expectations in this domain are limited to fractions with denominators 2, 3, 4, 6, and 8.)"
